{
  "$schema": "http://json-schema.org/draft-07/schema#",
  "$id": "https://cpokuru.github.io/CoreRDK-Broadband-Platform/schemas/hw-compat.schema.json",
  "title": "RDK-B Core Broadband Hardware Compatibility Metrics",
  "description": "Per-profile minimum CPU/RAM/flash and required peripheral hardware, published for consumption by the Core RDK Broadband docs site UI and related tooling.",
  "type": "object",
  "required": [
    "specVersion",
    "profileId",
    "profileName",
    "cpu",
    "memory",
    "requiredStorage",
    "referenceDevice",
    "peripherals",
    "validationStatus"
  ],
  "properties": {
    "specVersion": {
      "type": "string",
      "description": "Version of this JSON schema (semantic version), e.g. \"1.0\"."
    },
    "profileId": {
      "type": "string",
      "description": "Machine-readable profile identifier, kebab-case (e.g. \"ethwan-wifi-router\", \"ext-easymesh\")."
    },
    "profileName": {
      "type": "string",
      "description": "Human-readable profile name for display, matching the Hardware Compatibility Specification Section 1.1."
    },
    "cpu": {
      "type": "object",
      "required": [
        "architecture",
        "family",
        "minClockGHz",
        "minCores"
      ],
      "properties": {
        "architecture": {
          "type": "string",
          "description": "Instruction set / architecture family, e.g. \"arm64\"."
        },
        "family": {
          "type": "string",
          "description": "SoC core family, e.g. \"Cortex-A73\". This is the reference-device value; the normative architecture requirement is cpu.architecture, not this field."
        },
        "minClockGHz": {
          "type": "number",
          "description": "Minimum sustained clock speed in GHz."
        },
        "minCores": {
          "type": "integer",
          "description": "Minimum number of CPU cores."
        },
        "coreTopology": {
          "type": "string",
          "description": "Optional. Core arrangement note, e.g. \"dual-cluster\", \"single-cluster\"."
        }
      }
    },
    "memory": {
      "type": "object",
      "required": [
        "minRamMB"
      ],
      "properties": {
        "minRamMB": {
          "type": "integer",
          "description": "Minimum RAM in megabytes."
        }
      }
    },
    "referenceDevice": {
      "type": "object",
      "required": [
        "name"
      ],
      "properties": {
        "name": {
          "type": "string",
          "description": "Name of the validated reference device, e.g. \"BPI-R4\"."
        },
        "soc": {
          "type": "string",
          "description": "Optional. SoC used on the reference device."
        },
        "buildBranch": {
          "type": "string",
          "description": "Optional. Source branch used for the validated build."
        }
      }
    },
    "peripherals": {
      "type": "object",
      "description": "Required and optional peripheral hardware for this profile, grouped by class.",
      "required": [
        "connectivity",
        "storageInterface",
        "mediaTuner"
      ],
      "properties": {
        "connectivity": {
          "type": "object",
          "description": "WAN, LAN, Wi-Fi, EasyMesh, and IoT radio requirements.",
          "properties": {
            "wan": {
              "type": "object",
              "properties": {
                "required": {
                  "type": "boolean"
                },
                "interfaces": {
                  "type": "array",
                  "items": {
                    "type": "string"
                  }
                },
                "minPorts": {
                  "type": "integer"
                },
                "notes": {
                  "type": "string"
                }
              }
            },
            "lan": {
              "type": "object",
              "properties": {
                "required": {
                  "type": "string",
                  "enum": [
                    "required",
                    "optional",
                    "not-applicable"
                  ]
                },
                "interfaces": {
                  "type": "array",
                  "items": {
                    "type": "string"
                  }
                },
                "notes": {
                  "type": "string"
                }
              }
            },
            "wifi": {
              "type": "object",
              "properties": {
                "required": {
                  "type": "boolean"
                },
                "requiredStandards": {
                  "type": "array",
                  "items": {
                    "type": "string"
                  }
                },
                "optionalStandards": {
                  "type": "array",
                  "items": {
                    "type": "string"
                  }
                },
                "requiredSecurity": {
                  "type": "array",
                  "items": {
                    "type": "string"
                  }
                },
                "notes": {
                  "type": "string"
                }
              }
            },
            "easyMesh": {
              "type": "object",
              "properties": {
                "required": {
                  "type": "boolean"
                },
                "role": {
                  "type": "string",
                  "enum": [
                    "controller",
                    "agent-only",
                    "controller+agent",
                    "none"
                  ]
                },
                "transport": {
                  "type": "string"
                },
                "notes": {
                  "type": "string"
                }
              }
            },
            "bluetoothIot": {
              "type": "object",
              "properties": {
                "required": {
                  "type": "string",
                  "enum": [
                    "required",
                    "optional",
                    "not-applicable"
                  ]
                },
                "protocols": {
                  "type": "array",
                  "items": {
                    "type": "string"
                  }
                },
                "notes": {
                  "type": "string"
                }
              }
            },
            "cellular": {
              "type": "object",
              "description": "USB LTE dongle (RNDIS/MODEM mode, via CellularManager) or M.2 cellular modem WAN path, as an alternate/backup to Ethernet WAN.",
              "properties": {
                "required": {
                  "type": "string",
                  "enum": [
                    "required",
                    "optional",
                    "not-applicable"
                  ]
                },
                "interfaces": {
                  "type": "array",
                  "items": {
                    "type": "string"
                  }
                },
                "notes": {
                  "type": "string"
                }
              }
            }
          }
        },
        "storageInterface": {
          "type": "object",
          "properties": {
            "types": {
              "type": "array",
              "items": {
                "type": "string"
              }
            },
            "filesystem": {
              "type": "string"
            },
            "partitionLayout": {
              "type": "string"
            },
            "notes": {
              "type": "string"
            }
          }
        },
        "mediaTuner": {
          "type": "object",
          "properties": {
            "applicable": {
              "type": "boolean"
            },
            "notes": {
              "type": "string"
            }
          }
        },
        "diagnostics": {
          "type": "object",
          "properties": {
            "localWebUI": {
              "type": "string",
              "enum": [
                "required",
                "optional",
                "not-applicable"
              ]
            },
            "uart": {
              "type": "string",
              "enum": [
                "required",
                "recommended",
                "not-applicable"
              ]
            },
            "notes": {
              "type": "string"
            }
          }
        }
      }
    },
    "validationStatus": {
      "type": "string",
      "enum": [
        "not-started",
        "partial",
        "validated"
      ],
      "description": "Validation state of the values in this document, per the Reference Device Validation Methodology."
    },
    "lastValidated": {
      "type": "string",
      "format": "date",
      "description": "Optional. ISO-8601 date (YYYY-MM-DD) of the most recent validation pass. Under validationStatus: \"partial\", this means \"last tested\" \u2014 the date some subset of values were exercised on the reference device \u2014 not that every field in this file was confirmed at its exact stated value."
    },
    "memoryFootprintRef": {
      "type": "string",
      "description": "Optional. Relative path to this profile's separate memory-footprint file (see memory-footprint.schema.json), under the memory-footprint/ subfolder using the convention 'memory-footprint/<profileId>.memory-footprint.json', e.g. \"memory-footprint/ethwan-wifi-router.memory-footprint.json\". Answers 'what consumes the RAM minimum'. Kept out-of-line so per-process RSS data can be updated as components are profiled without revising this file."
    },
    "flashLayoutRef": {
      "type": "string",
      "description": "Optional. Relative path to this profile's separate flash-layout file (see flash-layout.schema.json), under the flash-layout/ subfolder using the convention 'flash-layout/<profileId>.flash-layout.json', e.g. \"flash-layout/ethwan-wifi-router.flash-layout.json\". Answers 'what is the flash layout / what consumes the flash minimum'. Kept out-of-line so partition sizing can be refined as real bring-up data comes in."
    },
    "cpuUtilizationRef": {
      "type": "string",
      "description": "Optional. Relative path to this profile's separate cpu-utilization file (see cpu-utilization.schema.json), under the cpu-utilization/ subfolder using the convention 'cpu-utilization/<profileId>.cpu-utilization.json', e.g. \"cpu-utilization/ethwan-wifi-router.cpu-utilization.json\". Answers 'what consumes the CPU minimum'. Kept out-of-line so per-process utilization data can be added as components are profiled."
    },
    "regionalRefs": {
      "type": "array",
      "items": {
        "type": "string"
      },
      "description": "Optional. Relative paths to this profile's separate per-region regional files (see regional.schema.json), under the regional/ subfolder using the convention 'regional/<profileId>.<regionId>.json', e.g. [\"regional/ethwan-wifi-router.us.json\"]. Answers 'can this hardware be deployed in a given region' (Hardware Compatibility Specification Section 7). One entry per region profiled; kept out-of-line since regional/certification status changes on its own timeline independent of this file."
    },
    "requiredStorage": {
      "type": "object",
      "required": [
        "minFlashMB",
        "supportedTypes"
      ],
      "properties": {
        "minFlashMB": {
          "type": "integer",
          "description": "Minimum flash storage in megabytes."
        },
        "supportedTypes": {
          "type": "array",
          "items": {
            "type": "string"
          },
          "description": "Flash technologies this requirement permits in production, e.g. [\"eMMC\", \"UFS\", \"SPI-NAND\"]. This is the REQUIREMENT, not necessarily what the reference device in validationEvidence was tested on."
        },
        "partitionLayout": {
          "type": "string",
          "description": "Optional. OTA partition layout, e.g. \"A/B\", \"single-bank\"."
        },
        "filesystem": {
          "type": "string",
          "description": "Optional. Filesystem used on flash \u2014 \"ext4\", \"squashfs\", or \"EROFS\" for eMMC/UFS; \"UBI/UBIFS\" for SPI-NAND. MUST be compatible with requiredStorage.supportedTypes; UBI/UBIFS MUST NOT be paired with eMMC or UFS."
        }
      }
    },
    "validationEvidence": {
      "type": "object",
      "description": "Optional. What was actually exercised on the reference device, distinct from the requiredStorage requirement itself \u2014 answers whether production storage technology was validated or a stand-in medium was used.",
      "properties": {
        "storageType": {
          "type": "string",
          "description": "Storage technology ACTUALLY present on the reference/validation device, e.g. \"SD\" \u2014 may differ from requiredStorage.supportedTypes (the production requirement)."
        },
        "productionStorageValidated": {
          "type": "boolean",
          "description": "True only if the reference device's actual storageType is itself one of requiredStorage.supportedTypes \u2014 i.e., production storage technology (not a stand-in medium like SD) was exercised."
        }
      }
    }
  }
}
