{
  "$schema": "https://cpokuru.github.io/CoreRDK-Broadband-Platform/schemas/hw-compat.schema.json",
  "specVersion": "1.0",
  "profileId": "ext-easymesh",
  "profileName": "EXT EasyMesh",
  "cpu": {
    "architecture": "arm64",
    "family": "Cortex-A73",
    "minClockGHz": 1.8,
    "minCores": 4,
    "coreTopology": "single-cluster"
  },
  "memory": {
    "minRamMB": 1024
  },
  "referenceDevice": {
    "name": "BPI-R4",
    "soc": "MediaTek MT7988 (Filogic)",
    "buildBranch": "rdkb-2025q4-kirkstone"
  },
  "peripherals": {
    "connectivity": {
      "wan": {
        "required": false,
        "interfaces": [],
        "minPorts": 0,
        "notes": "Not applicable - no WAN interface in this profile."
      },
      "lan": {
        "required": "optional",
        "interfaces": [
          "Ethernet"
        ],
        "notes": "Wi-Fi and Ethernet backhaul both supported; at least one Ethernet port recommended for wired backhaul option."
      },
      "wifi": {
        "required": true,
        "requiredStandards": [
          "802.11n",
          "802.11ac (Wi-Fi 5)"
        ],
        "optionalStandards": [
          "802.11ax (Wi-Fi 6/6E)",
          "802.11be (Wi-Fi 7)"
        ],
        "requiredSecurity": [
          "WPA2"
        ],
        "notes": "Wi-Fi AP fronthaul mandatory for extender role."
      },
      "easyMesh": {
        "required": true,
        "role": "agent-only",
        "transport": "IEEE 1905",
        "notes": "EasyMesh R6 Agent-Only role and IEEE 1905 transport are both mandatory for this profile."
      },
      "bluetoothIot": {
        "required": "optional",
        "protocols": [
          "Matter",
          "Zigbee",
          "Thread"
        ],
        "notes": "Same IoT feature set as EthWAN WiFi Router applies if enabled on the extender."
      },
      "cellular": {
        "required": "not-applicable",
        "interfaces": [],
        "notes": "Marked n/a for this profile in the RDK-B Component List 2026 (WAN Interface Features > Access Technology - Cellular). Cellular access technology is Optional only for GW / GW OpenSync / GW EasyMesh profiles; EXT EasyMesh has no WAN stack at all (extender role, Wi-Fi/Ethernet backhaul only)."
      }
    },
    "storageInterface": {
      "types": [
        "eMMC",
        "SPI-NAND"
      ],
      "filesystem": "UBI/UBIFS",
      "partitionLayout": "A/B",
      "notes": "A/B partition layout recommended for OTA."
    },
    "mediaTuner": {
      "applicable": false,
      "notes": "Not applicable - no WAN, voice, or tuner hardware in scope for the extender role."
    },
    "diagnostics": {
      "localWebUI": "optional",
      "uart": "recommended",
      "notes": "Typically not needed on an EasyMesh extender per component notes; UART/debug console recommended for bring-up."
    }
  },
  "validationStatus": "partial",
  "lastValidated": "2026-09-17",
  "flashLayoutRef": "flash-layout/ext-easymesh.flash-layout.json",
  "cpuUtilizationRef": "cpu-utilization/ext-easymesh.cpu-utilization.json",
  "memoryFootprintRef": "memory-footprint/ext-easymesh.memory-footprint.json",
  "regionalRefs": [
    "regional/ext-easymesh.us.json"
  ],
  "requiredStorage": {
    "minFlashMB": 4096,
    "supportedTypes": [
      "eMMC",
      "UFS",
      "SPI-NAND"
    ],
    "partitionLayout": "A/B",
    "filesystem": "ext4"
  },
  "validationEvidence": {
    "storageType": "SD",
    "productionStorageValidated": false
  }
}
